{
  "schema_version": "2.0",
  "skill_code": "user-validation-designer",
  "version": "1.0.5",
  "content_sha256": "0964927ad124e301386b21626ef59f2f161230c55acc534b980b2a267d3ad285",
  "package_sha256": "ac17e6b8c9b82760593a8a51eb2ab9959b0ff072a125f8237a19d52f21409192",
  "runner_sha256": "f0923fd01aa203217b85d1c6683dc7783cf1af10019f13302dadda13d37b10f0",
  "prompt_sha256": "a46381cbe819f6e09ae7df196295989bd4b3261470474be201497debd2e341a2",
  "knowledge_package_sha256": "d5951922224c9d16e9b013139795d074c706c3f589f8ffec918c499e910300d2",
  "input_schema_ref": "../../../user-validation-designer/schema/input.schema.json",
  "input_schema_sha256": "676b1d0968b1337bae5aa60dd148a17b94f885b874eddbb68cc1ea3ab816ce05",
  "output_schema_ref": "../../../user-validation-designer/schema/output.v0.2.schema.json",
  "output_schema_sha256": "81bfb80b385bfc9e3cb9429c88aae6eeeb40251c64817eccceed291c16990fbf",
  "preconditions": [
    "confirmed product profile with one_line_value_claim",
    "task-scoped AgentTeams capability token",
    "immutable product validation script for regression",
    "drained user-validation-designer 1.0.4 executions before cutover"
  ],
  "permissions": [
    "profile.read",
    "material.read",
    "evidence.read",
    "user_validation.checkpoint.write",
    "user_validation.result.write"
  ],
  "failure_classes": [
    "VALIDATION",
    "AUTHORIZATION",
    "DEPENDENCY",
    "BUDGET",
    "POLICY",
    "SUBMISSION_UNKNOWN",
    "BUSINESS"
  ],
  "budget": {
    "max_cost": 0,
    "currency": "USD",
    "max_model_turns": 12,
    "max_agent_iterations": 32,
    "task_timeout_seconds": 1200
  },
  "evidence_requirements": [
    "issued evidence is capped at E2 and identifies simulation",
    "caller E3-E5 evidence retains immutable source hash and applicability",
    "summary and full reports are deterministic fields in one immutable result object",
    "full report is never transported through Matrix"
  ],
  "lifecycle": {
    "status": "APPROVED_DISABLED",
    "feature_flag": "LAUNCHSCOPE_USER_VALIDATION_ENABLED",
    "rollback": "Disable the feature flag; retain both Skill generations and wait for 1.0.5 executions to drain before rolling back Runner code."
  },
  "may_write_business_state": false
}
